{
  "schemaVersion": 1,
  "operatorId": "counter-plus-one-site",
  "operatorVersion": 1,
  "operatorDigest": "9251494d6bf696e7535bee95d4dcd20f70e348b7e611dfa444ea6c1d9ff9fa07",
  "moduleDigest": "ae782108849322f59a40dba375c37d8c3742f9e9fcacf310bece09b7618e6d49",
  "phase": "semantic-input",
  "sentenceKinds": [
    "rule"
  ],
  "selectorDigest": "f87c5340e3add4cc5409998d2350826b297b911b24288077b732b2793624eff9",
  "joinDigest": null,
  "policy": "each",
  "expectedTupleCount": null,
  "expectedTupleArity": 1,
  "candidateCap": 16,
  "preconditionDigest": "5bbf78fd76f3641c0e6c65ec2fb198ba8d642c983224ecf5641b1284bbcba2db",
  "postconditionDigest": "d4577bcc779ff48cd77a0b79b1cd4b79d686c1bfc5cbb778c0404bfb68d5fd2b",
  "generatedSentencePolicy": "exclude",
  "patchTemplateDigest": "50a2da9c1180f778015058d64efc53b0e8f2f0e4cc1fe456af6141a3087183cc",
  "patchTemplateRoles": [
    {
      "name": "increment-replacement",
      "operation": "replace-term",
      "sourceSelectorRoles": [
        "increment-expression"
      ]
    }
  ],
  "category": "arithmetic-boundary",
  "rationale": "Prove join-free structural each-site discovery on a second portable definition family."
}
