{
  "schemaVersion": 1,
  "operatorId": "bag14-counter-branch-site",
  "operatorVersion": 1,
  "operatorDigest": "9c24e4ace339b27a5f748c3bab1dc72a82b7e2ae79eb309da9bda1367485906b",
  "moduleDigest": "ae782108849322f59a40dba375c37d8c3742f9e9fcacf310bece09b7618e6d49",
  "phase": "semantic-input",
  "sentenceKinds": [
    "rule"
  ],
  "selectorDigest": "4651d216891df52797542432f55c1e23ae410ae6f1d55a7486983900f24a69f0",
  "joinDigest": null,
  "policy": "each",
  "expectedTupleCount": null,
  "expectedTupleArity": 1,
  "candidateCap": 16,
  "preconditionDigest": "5bbf78fd76f3641c0e6c65ec2fb198ba8d642c983224ecf5641b1284bbcba2db",
  "postconditionDigest": "d4577bcc779ff48cd77a0b79b1cd4b79d686c1bfc5cbb778c0404bfb68d5fd2b",
  "generatedSentencePolicy": "exclude",
  "patchTemplateDigest": "b24cf6a57d0fa7a3a9147c49af9c63bd7b019f9db84b7d2b8c7189aae57076e7",
  "patchTemplateRoles": [
    {
      "name": "bag14-heating-attribute",
      "operation": "add-attribute",
      "sourceSelectorRoles": [
        "bag14-branch-result"
      ]
    }
  ],
  "category": "arithmetic-boundary",
  "rationale": "Finite BAG-14 cache conformance derivative; no native execution authority."
}
